{
  "$schema": "https://ruviz.dev/schemas/3d-performance-artifact-v1.json",
  "collection_errors": [],
  "coverage": {
    "measured_profile_count": 4,
    "measurement_count": 8,
    "required_profile_count": 13,
    "unmeasured_profile_count": 9
  },
  "gates": [
    {
      "available_measurement_ids": [
        "cpu.update.camera:scatter-100000",
        "cpu.update.camera:surface-100",
        "cpu.warm.unchanged_frame:scatter-100000",
        "cpu.warm.unchanged_frame:surface-100",
        "gpu.update.camera:scatter-100000",
        "gpu.update.camera:surface-100",
        "gpu.warm.unchanged_frame:scatter-100000",
        "gpu.warm.unchanged_frame:surface-100"
      ],
      "id": "gpu.scatter-1m.camera-p95",
      "metric": "p95_ns",
      "operator": "<=",
      "reason": "Performance gates require a declared fixed-hardware run; this artifact records observations only",
      "requires": "fixed hardware, 1M scatter, 800x600, camera-only GPU frame",
      "status": "not_evaluated",
      "threshold": 16700000
    },
    {
      "available_measurement_ids": [
        "cpu.update.camera:scatter-100000",
        "cpu.update.camera:surface-100",
        "cpu.warm.unchanged_frame:scatter-100000",
        "cpu.warm.unchanged_frame:surface-100",
        "gpu.update.camera:scatter-100000",
        "gpu.update.camera:surface-100",
        "gpu.warm.unchanged_frame:scatter-100000",
        "gpu.warm.unchanged_frame:surface-100"
      ],
      "id": "gpu.surface-512.camera-p95",
      "metric": "p95_ns",
      "operator": "<=",
      "reason": "Performance gates require a declared fixed-hardware run; this artifact records observations only",
      "requires": "fixed hardware, 512x512 surface, 800x600, camera-only GPU frame",
      "status": "not_evaluated",
      "threshold": 16700000
    },
    {
      "available_measurement_ids": [
        "cpu.update.camera:scatter-100000",
        "cpu.update.camera:surface-100",
        "cpu.warm.unchanged_frame:scatter-100000",
        "cpu.warm.unchanged_frame:surface-100",
        "gpu.update.camera:scatter-100000",
        "gpu.update.camera:surface-100",
        "gpu.warm.unchanged_frame:scatter-100000",
        "gpu.warm.unchanged_frame:surface-100"
      ],
      "id": "gpu.scatter-10m.camera-p95",
      "metric": "p95_ns",
      "operator": "<=",
      "reason": "Performance gates require a declared fixed-hardware run; this artifact records observations only",
      "requires": "fixed hardware, 10M scatter, camera-only GPU frame",
      "status": "not_evaluated",
      "threshold": 33300000
    },
    {
      "available_measurement_ids": [
        "cpu.update.camera:scatter-100000",
        "cpu.update.camera:surface-100",
        "cpu.warm.unchanged_frame:scatter-100000",
        "cpu.warm.unchanged_frame:surface-100",
        "gpu.update.camera:scatter-100000",
        "gpu.update.camera:surface-100",
        "gpu.warm.unchanged_frame:scatter-100000",
        "gpu.warm.unchanged_frame:surface-100"
      ],
      "id": "gpu.surface-1024.camera-p95",
      "metric": "p95_ns",
      "operator": "<=",
      "reason": "Performance gates require a declared fixed-hardware run; this artifact records observations only",
      "requires": "fixed hardware, 1024x1024 surface, camera-only GPU frame",
      "status": "not_evaluated",
      "threshold": 33300000
    },
    {
      "available_measurement_ids": [
        "cpu.update.camera:scatter-100000",
        "cpu.update.camera:surface-100",
        "cpu.warm.unchanged_frame:scatter-100000",
        "cpu.warm.unchanged_frame:surface-100",
        "gpu.update.camera:scatter-100000",
        "gpu.update.camera:surface-100",
        "gpu.warm.unchanged_frame:scatter-100000",
        "gpu.warm.unchanged_frame:surface-100"
      ],
      "id": "cpu.scatter-100k.warm-median",
      "metric": "median_ns",
      "operator": "<=",
      "reason": "Performance gates require a declared fixed-hardware run; this artifact records observations only",
      "requires": "fixed hardware, 100K scatter, retained CPU warm frame",
      "status": "not_evaluated",
      "threshold": 33000000
    },
    {
      "available_measurement_ids": [
        "cpu.update.camera:scatter-100000",
        "cpu.update.camera:surface-100",
        "cpu.warm.unchanged_frame:scatter-100000",
        "cpu.warm.unchanged_frame:surface-100",
        "gpu.update.camera:scatter-100000",
        "gpu.update.camera:surface-100",
        "gpu.warm.unchanged_frame:scatter-100000",
        "gpu.warm.unchanged_frame:surface-100"
      ],
      "id": "cpu.scatter-1m.warm-median",
      "metric": "median_ns",
      "operator": "<=",
      "reason": "Performance gates require a declared fixed-hardware run; this artifact records observations only",
      "requires": "fixed hardware, 1M scatter, retained CPU warm frame",
      "status": "not_evaluated",
      "threshold": 250000000
    },
    {
      "available_measurement_ids": [
        "cpu.update.camera:scatter-100000",
        "cpu.update.camera:surface-100",
        "cpu.warm.unchanged_frame:scatter-100000",
        "cpu.warm.unchanged_frame:surface-100",
        "gpu.update.camera:scatter-100000",
        "gpu.update.camera:surface-100",
        "gpu.warm.unchanged_frame:scatter-100000",
        "gpu.warm.unchanged_frame:surface-100"
      ],
      "id": "cpu.surface-512.warm-median",
      "metric": "median_ns",
      "operator": "<=",
      "reason": "Performance gates require a declared fixed-hardware run; this artifact records observations only",
      "requires": "fixed hardware, 512x512 surface, retained CPU warm frame",
      "status": "not_evaluated",
      "threshold": 300000000
    },
    {
      "available_measurement_ids": [
        "cpu.update.camera:scatter-100000",
        "cpu.update.camera:surface-100",
        "cpu.warm.unchanged_frame:scatter-100000",
        "cpu.warm.unchanged_frame:surface-100",
        "gpu.update.camera:scatter-100000",
        "gpu.update.camera:surface-100",
        "gpu.warm.unchanged_frame:scatter-100000",
        "gpu.warm.unchanged_frame:surface-100"
      ],
      "id": "cpu.surface-1024.static-median",
      "metric": "median_ns",
      "operator": "<=",
      "reason": "Performance gates require a declared fixed-hardware run; this artifact records observations only",
      "requires": "fixed hardware, 1024x1024 static CPU surface",
      "status": "not_evaluated",
      "threshold": 1200000000
    },
    {
      "available_measurement_ids": [
        "cpu.update.camera:scatter-100000",
        "cpu.update.camera:surface-100",
        "cpu.warm.unchanged_frame:scatter-100000",
        "cpu.warm.unchanged_frame:surface-100",
        "gpu.update.camera:scatter-100000",
        "gpu.update.camera:surface-100",
        "gpu.warm.unchanged_frame:scatter-100000",
        "gpu.warm.unchanged_frame:surface-100"
      ],
      "id": "warm-frame-stability",
      "metric": "p99_over_median",
      "operator": "<=",
      "reason": "Performance gates require a declared fixed-hardware run; this artifact records observations only",
      "requires": "fixed hardware and sufficient repeated warm-frame samples",
      "status": "not_evaluated",
      "threshold": 2.0
    },
    {
      "available_measurement_ids": [
        "cpu.update.camera:scatter-100000",
        "cpu.update.camera:surface-100",
        "cpu.warm.unchanged_frame:scatter-100000",
        "cpu.warm.unchanged_frame:surface-100",
        "gpu.update.camera:scatter-100000",
        "gpu.update.camera:surface-100",
        "gpu.warm.unchanged_frame:scatter-100000",
        "gpu.warm.unchanged_frame:surface-100"
      ],
      "id": "long-orbit-host-growth",
      "metric": "host_growth_bytes",
      "operator": "<=",
      "reason": "Performance gates require a declared fixed-hardware run; this artifact records observations only",
      "requires": "allocation measurement across 10K orbit frames",
      "status": "not_evaluated",
      "threshold": 1048576
    },
    {
      "available_measurement_ids": [
        "cpu.update.camera:scatter-100000",
        "cpu.update.camera:surface-100",
        "cpu.warm.unchanged_frame:scatter-100000",
        "cpu.warm.unchanged_frame:surface-100",
        "gpu.update.camera:scatter-100000",
        "gpu.update.camera:surface-100",
        "gpu.warm.unchanged_frame:scatter-100000",
        "gpu.warm.unchanged_frame:surface-100"
      ],
      "id": "glmakie-competitive-sanity",
      "metric": "ruviz_over_glmakie_warm_camera",
      "operator": "<=",
      "reason": "Performance gates require a declared fixed-hardware run; this artifact records observations only",
      "requires": "matched GLMakie run on the same fixed hardware",
      "status": "not_evaluated",
      "threshold": 1.5
    }
  ],
  "generated_at": "2026-07-23T18:14:04.455393+00:00",
  "measurements": [
    {
      "criterion": {
        "full_id": "3d/cpu/retained-camera-update/scatter-100000-640x480",
        "mean_confidence_interval_ns": {
          "confidence_level": 0.95,
          "lower_bound": 37212837.46896825,
          "upper_bound": 43398458.98015873
        },
        "mean_estimate_ns": 40464989.50313492,
        "median_confidence_interval_ns": {
          "confidence_level": 0.95,
          "lower_bound": 35662281.25,
          "upper_bound": 44229550.0
        },
        "median_estimate_ns": 42781629.46428572,
        "throughput": {
          "Elements": 100000
        }
      },
      "dataset": {
        "hash": "fnv1a64:563cdc01ad1eeb73",
        "id": "scatter-wave-100000",
        "identity_status": "verified"
      },
      "derived": {
        "elements_per_second_at_median": 2337451.874839887,
        "frames_per_second_at_median": 23.37451874839887
      },
      "diagnostics": {
        "reason": "Criterion artifacts contain timing samples but no RenderDiagnostics3D sidecar",
        "status": "unmeasured"
      },
      "id": "cpu.update.camera:scatter-100000",